"没售后买来怎么搞 ,3天就有问题，直接申请售后呗，肯定可以解决的 ,那你可能盲了 ,不是我说，能卖出去就见鬼了 ,这售后和一加等类似的，都是京东自营店铺售后，还是挺方便的，当然和满大街的小米没法比。 ,找当地售后  我们这有个鬼售后  ,线下mx5到手不到一星期电池鼓包。售后说是我摔的，然而手机连摔的痕迹都没有，从此不再觉得魅族好 ,  我买来三天。无限重启 售后不管   再不买魅族。 ,再等下双11，手上的苹果还没坏 ,盲猜鬼族用户成功 ,魅族手机从M8开始一直用，真的用户粘性很高，很多设计非常有心思，很人性化。但是！自从去年16spro屏幕碎了，碎屏险寄回去修了一个多月才给我寄回来之后，真的不太敢买了…魅族现在最大的问题在于线下基本没有，包括售后和体验中心，销量很难上去，上不去就没有上下游的话语权，最后就啥都赶不上热乎的，然后销量就更上不去，恶性循环… ,你见鬼了？ ,见到你了啊 ,多多3499买的。。。 , ,魅族的手机颜值一直在线，设计上也有追求。但现在销量太少，面临生存问题，系统维护、售后都存在隐患。不敢买了。 ,对自己好一点嘛，咋说买个16t. ,售后找京东，然后拼人品。 ,3千以下，指日可待。 ,手机要什么售后[高兴]，16s用了两年自己屏幕后盖换了个遍，买的白色的现在换的前后全黑 ,嗯，够暴躁的 ,夕夕此刻3299 ,2999我一定会考虑 ,哈哈，暴躁老哥，我喜欢[惊喜] ,好几年没买过超过2千的手机了，喜欢魅族可惜今年没千元机了，16x换个电池继续用。 ,投票没输过，销量。。。 ,千万别买 质量太差了。   谁买谁后悔[喜极而泣][喜极而泣] 我买来三天。无限重启 售后不管   再不买魅族。 , ，16s用了两年自己屏幕后盖换了个遍，买的白色的现在换的前后全黑 ,  ,用了3年的MX6上周突然无限自动重启（甚至不能关机），刷系统也无法恢复后决定去实体店看看是否还有16T或16SP，结果围着所在城市转了大半圈，3家线下店都关门了……虽然觉得魅族还挺好用，但是3500以上又下不了手。今年也不出2K价位的手机了，可惜…… ,MP3时期倒腾过四五个，最后遇到了miniplayer，觉得完美啊。手机是从mx4 pro开始用的，每代旗舰都体验过，到两个月前的17和现在手持的17 pro。怎么说呢？问题肯定有，但我觉得都不是什么大问题。关于售后，一家六口人都用的，总共坏过一次听筒，送修的，立等即取，摔碎过一次屏，但是给上门更换了。而且这手机用起来挺趁手的，功能细节都挺喜欢，所以也没觉得需要换别的什么手机。鬼族，就鬼族吧 ,从mx4开始一直用魅族，不出意外下部还会是，但我在等1999 ,我的16x上市才两年，16s是19年上市吧 ,想想魅族钱包就哇凉哇凉的了！ ,为啥还不降价啊 ,等个2499 ,16th流畅使用中，福来米8.1-- 8.15版本简直完美。,赶紧降价，我要换手机 ,快要凉凉了 ,坐等双十一2599 ,千万别买 质量太差了。   谁买谁后悔 ,你看他评价和爆料,售后太差，把上海唯一一个维修点的服务人员全部开除 ,手机要什么售后 ",https://www.smzdm.com/p/24474451/,MEIZU 魅族 17 5G 智能手机 8GB 256GB
"不如港版，港版现在还送耳机。 ,学生价还能低 ,原封未激活我能做到8600的价格 ,双11 会有你要的价格 s20u有可能更低 ,好价，现在就等快递退回了， ,怎么看学生价 ,刹那不是一直吹自己是真发票吗？ ,note9的电池都顶不住，不常开流量还好点 ,我就想知道这个烧屏咋解决 ,围脖的刹那不是还行么，虽然我没买过 ,这家有512g迷雾金，价格也贵个四百。 ,先成为学生认证的一员 ,韩版note20u 马云家已经有6200多的了 ,这才刚刚开始，跳水星，请开始你的表演 ,韩版 港版 折算只要6000多而已，国行再等等吧，钱不是大风刮来的。 ,京东学生价更便宜，还送无线充电器 ,港版的7399送buds live，折算下来差不多6500不到！ ,深圳的朋友到去当地门店购买用，市镇府补贴10%促进消费 ,棒子疯狂了！ ,八月份都结束了呀？难道延长了？ ,6500等s20u或者note20u ,3个亿还没被领完，持续着呢 ,这个应该是 你  我  3000 ,等琼版出来，看免税后能少多少钱 ,我不管 我就买红米k30u ,不要等什么12了，赶紧下单吧，早买早享受 ,这个国家的东西一律不值 ,假发票解毒 ,深圳的朋友到去当地门店购买用，市镇府补贴10%促进消费[高兴] ,真的是太贵了 一个手机 不是我等能消费得起的啊 还是乖乖的等降价吧 我的note8应该还能坚持半年 ,不要韩版 想要国行 ,在哪里可以享受？ ,下载银联云闪付你可以找到店，已经享受折扣的产品列表 ,  ,拼多多终于出手了 , 用了两年的note9 不到半年的时候就已经烧屏很厉害了。。 ,过了10号就没活动，而且要自己去香港取货，还是有一定成本的。 ,京东比他还低几十块 ,今天下单了黑色，耳机估计也要花大量时间等 ,6199等一波 ,苏宁易购、国美、顺电都有 ,你，我，200[装大款] ,到底是买这款好还是买S20 U好啊？？？哪位大神给指个路啊！！！ ,人家直接不敢跟你联系代取 你说呢？ ,还是国行省心。虽然三星国行售后也是稀烂 ,还是港版香啊 ,开始了开始了 ,年底6000以下，入手 ,毫无诚意，百亿补贴虽然木有便宜，好歹还送个红米note8 ,韩版用不了指纹支付，输密码，麻烦，港版不大清楚 ",https://www.smzdm.com/p/24474425/,SAMSUNG 三星 Galaxy Note20 Ultra 5G智能手机 12GB+256GB
"深圳某房间：pa~让你当黄牛🐂 ,[皱眉]我寻思这是线下卖的，这个价很正常啊，同类竞品ov的也差不多。[邪恶]目标用户也不是咱们 ,一样，性价比高的不看 机皇不看，只盯着电子,信仰也不是这样信仰的，,畅享10e:又来抢我圾皇宝座 ,那你就再找找，天机720，屏幕720，LCD，无NFC，像素4800万，1/2英寸，我理解为欺骗老百姓。 ,LCD屏，服气 ,能买这手机的怕是蒙娜丽莎的妹妹——珍妮玛莎 ,减钱上1000plus ,当看到售价时候我啥话也没说，直接在网站上订购了1000万部，只在订单上备注了我的qq号。没过两天，我的qq响了，一看是任正非请求添加好友。我笑了笑，别人千方百计想认识的人，我只花了250亿。任正非说了，兄弟，以后你来深圳就找我。听懂掌声。 ,割完最后一波，趁早完蛋 ,这么多的描述就不提处理器 ,搞得旗舰机就值得买一样...要啥啥没有 6000元买转子马达[抽烟] ,这个标值2000 ,今天买了6+64  1699的X10感觉比这货值 ,天机800CPU卖2000+，给我一个不买小米K30至尊的理由 ,我到手就关震动，商务人士不用震动 ,难道骗小白就不能批评了吗... ,线下之王，mate30青春版！ ,红米K30尊享不香？ ,配置，我本来期待40了，但是现在没有必要等了。[黑线][黑线][黑线][黑线][黑线][黑线] ,CPU型号, ,老板跑路捞一笔 ,富婆也不用？ ,京东压根连。处理器型号都没有 参数就写的联发科 ,天机720 ,悲哀的华为，要完蛋了 ,不就是麒麟天玑720吗？瞧你们热闹的，难道HIAWEI这个标不值钱？ ,MediaTek MT6853 5G ,你都来这了，不知道华为nova.荣耀数字和v系列？ ,看到评论我就放心了。 ,这各种720组合韭菜割的看不起国人智商，ov厂妹机的话差不多这个要叫民工机了 ,对啊，1699的720p屏幕， ,（还没到三星的价位），苹果只有a13和wifi6等小升级就敢卖三千多的se被夸性价比高，华为阉割充电等的p40四千就是,让每一个中国人都能用的上华为 ,所以线下不懂的人就活该被坑？ ,畅享10e后继有人 ,说得好像三星a系列不是电子,华为国产，小米就不是国产了？堆别家厂商的零部件谁不会 ,虽然被制裁，但是也不能胡混对吧 ,我去，不会吧720的屏幕？ ,三星s note系列贵，那是消费者的问题，a系列电子,线下oppo reno4 8+128 2600 ,哈哈，看见大家骂它我就放心啦 ,我愿称之为电子,cpu720，屏幕720p。。。无语 ,历史上最黑的品牌。高价低配令人发指 ,就是不提处理器是什么的，,  ,。 ,分析师都说了，华为要玩完 ,最后一批爱国韭菜，不割白不割 ,这价格，这配置点值的不是水军我不信 ,2000档年度圾皇 ,天机720卖2300起？牛*，还是,爱国是无价的 ,我一直希望国内各个行业多出几家有华为这种实力的公司，也挺为华为目前的遭遇深感不公，但这次有点过分了 ,，华为智慧屏因为名字被日常嘲笑，苹果视网膜屏幕那可真的是高大上，某些人双标玩的别太明显了 ,我本来还想支持支持的，但是你这叫我怎么支持？本来就是低端系列都卖这么贵还用的这么,让你们瞎说什么市花 , 你可以对比差距 ,做工好，信仰加持，还有啥优点来着？ ,这cpu？这屏幕分辨率？这价格？这是连韭菜的根都要一起割了？ ,华为除了旗舰机，其他的都不建议买！！！ ,资本家的本质是不会变化的，吸血鬼 ,我翻了三次愣是没有找到 ,虽然大家爱国，但华为也不能高价卖电子,这价格上k30u不好吗？ ,喷？ ,你买我推荐！！！ ,这次割的不是韭菜，是韭中韭霸，听懂掌声 ,纳米镀膜是啥材质？ ,也闭口不提，麦芒畅享系列一定要喷到华为为止，p mate系列贵就是",https://www.smzdm.com/p/24490386/,新品发售 : HUAWEI 华为 畅享20 Plus 5G智能手机 6GB+128GB
"那时候你会想买新的机器啦 ,拍照还是三星水果。。。 ,明年618希望能冲[吐舌][吐舌][吐舌][吐舌][吐舌] ,应该是苏宁吧，京东毛活动都没有 ,果然是很久没看手机里 ,我现在用的华为mate30Pro  也没感觉拍出来很棒，感觉比我上一部小米6也没提升多少[大囧] ,好久没看手机了，小米现在都怎么贵了吗，不是走性价比路线的吗，记得以前旗舰顶配也才3k左右 , ，发热是有，可是不至于网上说的那么夸张到暖手宝的程度吧 , 别说你身边一个用建行信用卡的人都找不到，而且持续很久了，自己办一张也来得及吧 , ，起床的时候电量剩下10%左右，插入充电，起个床洗漱的时间就能充到90%左右 ,下午刚买的交行12+256  立减300+12期免息，明天到手 ,我8行第二次申请 建行批了…… ,你不退货，还可以领略下小米的,深圳线下5650购入，未翻车 ,简直笑话。米10至尊秒天秒地的拍照，有本事就对比。跟华为ppp不妨多让。 ,哪里有啊，老哥 ,首发预订入手到现在 ,首发预订入手到现在[邪恶]，发热是有，可是不至于网上说的那么夸张到暖手宝的程度吧[皱眉]。我也曾经用过P40 PRO+,感觉使用温度都差不多[亲亲],当然拍照方面是华为的P40 PRO+好点[邪恶]，对于我来说这机器最大的亮点是120W快充[不出所料]，起床的时候电量剩下10%左右，插入充电，起个床洗漱的时间就能充到90%左右[脸红]，在实际生活中还是很方便的，用了就回不去了[脸红] ,明年618希望能冲 ,刚退了，发热厉害，简直就是暖手宝，费电！重！外加我买了个问题货，nfc无法使用，这品控，这价格一言难尽 ,自营用建行信用卡5799吧[抠鼻]别说你身边一个用建行信用卡的人都找不到，而且持续很久了，自己办一张也来得及吧 ,都一个意思，都是噱头 , ，对于我来说这机器最大的亮点是120W快充 ,售后，当年首发入手小米8，碰到闪屏门，保险期内反复划水维修5次，不肯换新手机，不肯更换主板，屏幕，过保修期没有一个月又坏了，让你自费维修，多好的售后服务 ,建行-200加上24期免息还是很值的 ,自营用建行信用卡5799吧 ,黄牛报价5420 ,线下到手，只有透明的8+256版本，12g版本没有。官方价，但是送东西，直接抵现买了50w的无线。夜间拍照再未升级新版本前极限高光压制差点意思，光晕太明显。另外120倍变焦实用性一般，手持基本就是看个糊，抖的不行。拍月亮50倍就可以了。所以120变焦真的有点太抽数，或者就是为了堆料。导致广角在最下面。至于发热问题，不是暖手宝，但是真的热，相比之前用的note3几乎发热是我背部没了，然后长时间抖音后的温度。这个问题真别否认，就是事实。另外高刷续航头天真的不行，玩了一会儿就开始掉电。但是充电速度真的快，不过你会背着充电头到处跑吗？不过你问我值不值得买，我只想说感谢友商的衬托，这机器性价比真的到位，拍照也能满足。所以早买早享受。毕竟看看10 pro才跌多少就停产让路了。所以机器短时间贬值率不会太高的 ,明年618就买小米11了，到时候屏下一出，再买这个就感觉有点落后了 ,希望1年内跌到4千以内 ,米11貌似还是挖孔。估计屏下是mix…… ,已售罄................................... ,之前的小米旗舰啥配置？现在啥配置？纵向比没有可比性的话，就和三星苹果横向比一下，买手机买的不只是牌子 ,和这个也只差60啊，不多呀 ,小米的摄像不论堆多少料，拍出来总是差点意思。 ,国产现在都这么膨胀的吗？ ,发热严重，整个就是暖手宝 ,米6拍照是真不行，上课拍个板书都糊成啥样了，和mix2s都没得比了 ,最低配可能，其他不太可能 ,  ,这才几天就少了111 ,我现在用的华为mate30Pro  也没感觉拍出来很棒，感觉比我上一部小米6也没提升多少 ,你这话让我握紧了手里的米6 , 。我也曾经用过P40 PRO+,感觉使用温度都差不多 ,第三方的还是算了 ,上午就看见说京东交行立减300，但下单没有看见。。。。 ,建行忌讳多行，超5行信用卡再申请建行基本没戏 , ，在实际生活中还是很方便的，用了就回不去了 ,怎么买呀，交行 , ,当然拍照方面是华为的P40 PRO+好点 ,下雨的那点水肯定防得了 ,缺个防水啊，有防水早买了，现在选择等等水果。下雨天防水还是很有必要 ",https://www.smzdm.com/p/24488924/,MI 小米10 至尊纪念版 5G智能手机 12GB+256GB
"被砍单3次，怒打不值。 ,超出配送范围，想买买不了 ,给家长买6g就够用了，用个微信不至于卡。要要游戏中体验还是k30毕竟120刷新和骁龙 ,买华为啥 说清楚 ,等不到1299的k30了，给老人买这个凑合用 ,他家开不了增票，要不然价格低 ,被砍单5次 ,同价位的 华为也就X9和5Z了吧 但是真没这个香 ,正在用，一切正常 , 紫薯布丁 ,等！必须等！ ,等不到1299的k30了，给老人买这个凑合用[苦恼][苦恼] ,千万别买白色 丑的1B ,一千积分88元开 ,红米note8pro跟这货比咋样 我看可以选8+128 再加个10块撸的夏新64G存储卡 给老妈聊微信拍照够了吧 ,反应特别慢，经常卡顿 ,这价格不如买p40 pro+分12期 ,王一博都不会用的手机 ,999绝对不能再多了 ,天猫超市，1499，88会员95折，1424元，今天天猫超市卡充值1188送53元，充值299送8元，折合充值1487送了61元。实际到手1363元，虽说有人说是第三方发货，我觉得还是比拼多多靠谱一点？昨天还有下单立减50，我错过了。之前买了一台到了，没问题全新未拆。今天又买了一台。 ,刚需可入，不着急可以等后面起码能降200 ,有没有256g的，性价比高的？ ,256没性价比，建议128够用 ,这价钱你能买到华为？ ,5g手机现在都这么便宜了吗 ,4g版的吗 ,  ,官网咋蹲的？求分享 ,买了一只白色。一只蓝色，磨砂玻璃质感，白色会泛紫光，1349，有两家店在做百亿补贴活动 ,88会员额外要888元开。 ,华为 他不香吗？ ,什么牌子你说一下 ,这个价格还不如买别的牌子的呢 ,前几天在官网蹲了个1349的k30,可惜6G带miui12属实不理想。 ,昨天买的8加128，1549。贼坑了 ,我还想1199。。。1099。。。999呢！,爱国 ,1150买了二手的，上一家买了两周。感觉挺好的，玩王者也够，用起来也不怕摔 ,为什么我用起来有时候会很卡？续航也不大行，比我用了一年多的k20pro强不了多少 ,那肯定的，一博用iPhone ,话说，唯一的区别是主摄像头，怎么安兔兔跑分低了3万分？ ,华为呀  紫薯布丁 ",https://www.smzdm.com/p/24486148/,百亿补贴 : Redmi 红米 K30i 5G智能手机 6GB+128GB
"价格战要来了吗？ ,我这里批发价5040 ,5599 5678 ,你我800 ,唯一缺点就是掉电太快了 ,太厚！！！ ,你我200 ,本质上和10pro差别不大，但是贵了一两千 ,不敢买zsbd ,说一个不重的超大杯来？ ,手机值得买，用起来真香。第三方卖家，这价格不如就去官方买。 ,机身重量方面，小米10至尊纪念版全面向“索半斤”看齐，净重达到了221.8克，若再戴个手机壳、贴块钢化膜，重量直逼半斤。 ,其实ppp也是很厚很重 ,有没有便宜的k30 pro啊 ,如果想买  可以去门店看看  发热不爽 ,不是苏宁自营啊 ,明年会涨价么 ,太厚太重了 ,不是自营的话不算是好价啊，等PDD的百亿补贴吧 ,晚上待机掉点快的话，把系统自带的“健康”卸载了就行 ,系统下载完整更新包  你会发现有惊喜 ,有点夸张，这个速度 ,先加价600给你减300 ,看清楚，先提价了 ,比华为p40pp，苹果12pm,三星s20u轻 ,有，amd的显卡，因特尔的cpu ,你是用不起pro max吗？看看重不重。 ,你那四个哪里？ ,四千八某鱼买了x2 pro我觉得比这个值 ,这个性价比根本不如小米10，小米10系列都三个月就降价了三四百，这个降价降得更快 ,疯了吧，小米而已 ,我也是掉电快，不知道是不是刚换手机相册后台同步 ,机身重量方面，小米10至尊纪念版全面向“索半斤”看齐，净重达到了221.8克，若再戴个手机壳、贴块钢化膜，重量直逼半斤 ,oppo算了吧。首发买了个8+256的findx2，比小米10pro同配置贵多了。前两天咸鱼才卖出去，只卖了3200，还不够买一个小米10pro的。 ,你在开玩笑？一加8是超大杯吗？一加都没有超大杯。已发布的超大杯三星S20U、华为P40ProPlus、苹果iPhone11ProMax，米10至尊，哪个不是220g以上？ ,开始 降价了吗？ ,电子产品还有不跌价的？ ,这是256啊大哥们，等12+256的 ,明年会降价吗？ ,  ,第三方，还提价后用券，还不如自营用建行信用卡一样5399 ,你的有没有觉得掉电比较快？我的掉电很快，不知道个案还是都这样 ,一加8  200克不到 ,上月5799元入了12g+256g,建行减了200加上12期免息，120W闪充是真香，刷新率很流畅，玩在看旧手机不忍直视，早买早享受，目前代表着最高科技 ,玩不了多久  发热  一般玩王者荣耀 一个小时三十电这样 ,见仁见智咯。萝卜青菜各有所爱 ,小米10至尊版221g,华为p40pro+  226g,用几天就习惯了，不会在乎那二三十克重量 ,来一次我问一次，导航正常吗？一导航就是信号弱 ,除了120w没啥科技吧 ,真的重啊 苹果都嫌重了 这个还更重 ,目前自用12+256，什么都好就是太厚重了。用了几天再看旧机6SP,觉得好不习惯，那个上下大黑边 ,价格战要来了吗？[高兴] ,一直玩能用多久 ",https://www.smzdm.com/p/24477514/,MI 小米10 至尊纪念版 5G智能手机 8GB 256GB
"学生认证的确是好价 ,可以分期啊 这个时间一个月几百块 ,港版6400可以到手[黑线] ,淘宝7428入了，再花312块找了个跑腿确实香，但跑腿确实全靠信任 ,我在7428销量最高那店买的，但现在刹那家的价钱也不错 ,学生买这？ ,三星：我太难了 ,双十一 6199一定买 ,棒子的手机好贵啊 ,你  我   5999 ,还好已经毕业很多年了，否则又有可能中了这个什么计哈哈 ,还有这么多人用三星啊 ,面部识别就是摆设。拍照很一般。入手两个多月了。信我。 ,苏宁首发前就这价格。。不过镜头进灰，电池5小时，充电缩水 ,电池真的不行，充电慢死，耗电快死 ,现在的学生，不用旗舰机都不好意思说自己在上学 ,咋搞学生验证啊 小学生可以吗？ ,支持你，布丁 ,有24免息分期还可以 ,铜色，说是9月10前登记都有。我已经登记了，就等耳机发货了 ,老哥，你买的是帮你代领还是需要自己找跑腿 ,已入手港版7428 还送耳机 ,有香港的朋友代拿 ,哪个店？靠谱吗 ,学生用着手机，还是学生吗？ ,这波操作很变态啊…，这是让为人父母难堪？学生用1⃣️W手机？ ,用的用的就爆炸了 ,不是很贵，但是给学生刮消费主义的风不好吧 ,他指的耳机回血 ,再降一点啊，6999交个朋友 ,这是NOTE 20u不是NOTE 20 ,只要说明可以登记领耳机的应该都是真发票 ,带个路啊！ ,我是差那60块钱的人吗 我差的是6000 ,京东比拼多多便宜？[狂汗] ,学生价……现在的学生真有钱 ,关注你了，希望别打脸 ,如何进入学生价格？ ,  ,5999等着你 ,学生都用这么贵的手机吗？ ,苏宁一直是这个价格吧？ ,只能发香港地址哦 ,没看到有学生认证的地方啊 ,这评论里有些人对于价格真的应该多见见世面 可怕 ,我读书的时候领国家助学金的买最新的诺基亚旗舰，花几大千买游戏账号。真正穷的羞于开口，从来没去申请。 ,五千，五千绝对交个朋友。 ,7000我绝对下手。 ,耳机应该需要自己领吧，网上的页面填了嘛，顺丰那一页可以选择内地嘛 ,因为喜欢这种方方正正棱角分明的机型还有想玩spen所以入了 ,我也7428入了，顺丰地址只能寄香港范围吧，我准备让我朋友去拿再用寄过来 ,京东比拼多多便宜？ ,什么颜色的？我才下单，怕来不及登记耳机 ,也就学生能用的起 ,刚发布一个月你用了两个月？ ",https://www.smzdm.com/p/24500240/,SAMSUNG 三星 Galaxy Note20 Ultra 5G智能手机 12GB+256GB 迷雾金
